{
  "apiVersion": "aide.dev/v1alpha1",
  "kind": "ConformanceProfile",
  "metadata": {
    "compatibility": {
      "featureFlags": [
        "minimal_conformance_profile"
      ],
      "minReaderVersion": "0.1.0",
      "minWriterVersion": "0.1.0",
      "protocolVersion": "0.1.0",
      "requiredCapabilities": [
        "minimal_conformance_profile",
        "minimal_capability_manifest"
      ],
      "schemaVersion": "0.1.0"
    },
    "createdAt": "2026-06-18T00:00:00+10:00",
    "id": "conformance-profile-minimal-capability-manifest-v1",
    "name": "Minimal CapabilityManifest ConformanceProfile",
    "producer": {
      "name": "aide-lite",
      "version": "0.1.0"
    },
    "sourcePath": ".aide/reports/conformance-profile/profiles.json",
    "title": "Minimal CapabilityManifest ConformanceProfile"
  },
  "protocol_version": "0.1.0",
  "schema_version": "aide.conformance-profile.v0",
  "spec": {
    "accepted_predecessor": "minimal_capability_manifest",
    "admission": {
      "admission_performed": false,
      "implemented": false,
      "policy_decision": false,
      "trusted": false
    },
    "aggregation_policy": {
      "admission_decision": "out_of_scope",
      "advisory_case_failure": "informational_warning",
      "dependency_failure": "fail_closed_for_dependent_required_cases",
      "missing_required_case": "fail_closed",
      "optional_case_failure": "warning_only",
      "required_cases": "all_required_cases_must_have_accepted_outcomes",
      "unknown_advisory_evaluator": "warn_only",
      "unknown_optional_evaluator": "warn_only",
      "unknown_required_evaluator": "fail_closed"
    },
    "cases": [
      {
        "accepted_outcomes": [
          "PASS",
          "PASS_WITH_WARNINGS"
        ],
        "admission_performed": false,
        "case_id": "capability-manifest-schema-parses",
        "case_ref": "aide://conformance-profile/minimal_capability_manifest-v1.0.0#capability-manifest-schema-parses",
        "dependencies": [],
        "description": "The accepted CapabilityManifest schema exists and parses as JSON.",
        "evaluator": "schema_parse",
        "evidence_required": [
          ".aide/protocol/aide-capability-manifest.schema.json"
        ],
        "execution_implemented": false,
        "requirement_level": "required",
        "result_generated": false,
        "result_ref": null,
        "source_refs": [
          "aide://schema/aide-capability-manifest",
          "aide://queue-task/AIDE-BUILD-CAPABILITY-MANIFEST-01"
        ],
        "title": "CapabilityManifest Schema Parses"
      },
      {
        "accepted_outcomes": [
          "PASS",
          "PASS_WITH_WARNINGS"
        ],
        "admission_performed": false,
        "case_id": "capability-manifest-projection-json-valid",
        "case_ref": "aide://conformance-profile/minimal_capability_manifest-v1.0.0#capability-manifest-projection-json-valid",
        "dependencies": [
          "capability-manifest-schema-parses"
        ],
        "description": "The accepted CapabilityManifest projection and index reports parse as JSON.",
        "evaluator": "json_report_valid",
        "evidence_required": [
          ".aide/reports/capability-manifest/capabilities.json",
          ".aide/reports/capability-manifest/capability-index.json"
        ],
        "execution_implemented": false,
        "requirement_level": "required",
        "result_generated": false,
        "result_ref": null,
        "source_refs": [
          "aide://report/capability-manifest-capabilities",
          "aide://report/capability-manifest-capability-index"
        ],
        "title": "CapabilityManifest Projection JSON Valid"
      },
      {
        "accepted_outcomes": [
          "PASS",
          "PASS_WITH_WARNINGS",
          "ACCEPTED_WITH_WARNINGS"
        ],
        "admission_performed": false,
        "case_id": "capability-manifest-validation-pass-with-warnings",
        "case_ref": "aide://conformance-profile/minimal_capability_manifest-v1.0.0#capability-manifest-validation-pass-with-warnings",
        "dependencies": [
          "capability-manifest-projection-json-valid"
        ],
        "description": "CapabilityManifest validation reports PASS_WITH_WARNINGS and preserves warning debt.",
        "evaluator": "predecessor_validator",
        "evidence_required": [
          ".aide/reports/capability-manifest/validation.json",
          ".aide/reports/capability-manifest-check/check-report.json"
        ],
        "execution_implemented": false,
        "requirement_level": "required",
        "result_generated": false,
        "result_ref": null,
        "source_refs": [
          "aide://queue-task/AIDE-BUILD-CAPABILITY-MANIFEST-01",
          "aide://queue-task/AIDE-CHECK-CAPABILITY-MANIFEST-01"
        ],
        "title": "CapabilityManifest Validation Preserved"
      },
      {
        "accepted_outcomes": [
          "ACCEPTED",
          "ACCEPTED_WITH_WARNINGS",
          "PASS_WITH_WARNINGS"
        ],
        "admission_performed": false,
        "case_id": "capability-manifest-acceptance-evidence-complete",
        "case_ref": "aide://conformance-profile/minimal_capability_manifest-v1.0.0#capability-manifest-acceptance-evidence-complete",
        "dependencies": [
          "capability-manifest-validation-pass-with-warnings"
        ],
        "description": "The acceptance queue task exists, remains at needs_review, and has no missing evidence.",
        "evaluator": "queue_task_status",
        "evidence_required": [
          ".aide/queue/AIDE-ACCEPT-CAPABILITY-MANIFEST-01/task.yaml",
          ".aide/queue/AIDE-ACCEPT-CAPABILITY-MANIFEST-01/status.yaml",
          ".aide/queue/AIDE-ACCEPT-CAPABILITY-MANIFEST-01/evidence/acceptance-summary.md"
        ],
        "execution_implemented": false,
        "requirement_level": "required",
        "result_generated": false,
        "result_ref": null,
        "source_refs": [
          "aide://queue-task/AIDE-ACCEPT-CAPABILITY-MANIFEST-01"
        ],
        "title": "CapabilityManifest Acceptance Evidence Complete"
      },
      {
        "accepted_outcomes": [
          "PASS",
          "PASS_WITH_WARNINGS",
          "ACCEPTED_WITH_WARNINGS"
        ],
        "admission_performed": false,
        "case_id": "capability-manifest-declaration-only-boundary",
        "case_ref": "aide://conformance-profile/minimal_capability_manifest-v1.0.0#capability-manifest-declaration-only-boundary",
        "dependencies": [
          "capability-manifest-acceptance-evidence-complete"
        ],
        "description": "CapabilityManifest declares capability state without proof, execution, admission, or adapter trust.",
        "evaluator": "boundary_review",
        "evidence_required": [
          ".aide/queue/AIDE-ACCEPT-CAPABILITY-MANIFEST-01/evidence/capability-boundary-review.md",
          ".aide/queue/AIDE-ACCEPT-CAPABILITY-MANIFEST-01/evidence/non-capability-boundary.md"
        ],
        "execution_implemented": false,
        "requirement_level": "required",
        "result_generated": false,
        "result_ref": null,
        "source_refs": [
          "aide://queue-task/AIDE-ACCEPT-CAPABILITY-MANIFEST-01",
          "aide://capability/minimal_capability_manifest"
        ],
        "title": "Declaration-Only Boundary Preserved"
      },
      {
        "accepted_outcomes": [
          "PASS",
          "PASS_WITH_WARNINGS",
          "ACCEPTED_WITH_WARNINGS"
        ],
        "admission_performed": false,
        "case_id": "accepted-warning-debt-classified",
        "case_ref": "aide://conformance-profile/minimal_capability_manifest-v1.0.0#accepted-warning-debt-classified",
        "dependencies": [
          "capability-manifest-acceptance-evidence-complete"
        ],
        "description": "Accepted warning dispositions remain visible and are not repaired opportunistically.",
        "evaluator": "report_review",
        "evidence_required": [
          ".aide/queue/AIDE-ACCEPT-CAPABILITY-MANIFEST-01/evidence/warning-disposition.md",
          ".aide/reports/capability-manifest-accept/warning-disposition.md"
        ],
        "execution_implemented": false,
        "requirement_level": "required",
        "result_generated": false,
        "result_ref": null,
        "source_refs": [
          "aide://report/capability-manifest-accept-warning-disposition"
        ],
        "title": "Accepted Warning Debt Classified"
      },
      {
        "accepted_outcomes": [
          "PASS",
          "PASS_WITH_WARNINGS"
        ],
        "admission_performed": false,
        "case_id": "reference-and-event-refs-parse",
        "case_ref": "aide://conformance-profile/minimal_capability_manifest-v1.0.0#reference-and-event-refs-parse",
        "dependencies": [
          "capability-manifest-projection-json-valid"
        ],
        "description": "Projected source, evidence, report, event, and capability refs remain syntactically valid.",
        "evaluator": "reference_id_validator",
        "evidence_required": [
          ".aide/reports/reference-id/validation.json",
          ".aide/reports/event-record/validation.json"
        ],
        "execution_implemented": false,
        "requirement_level": "required",
        "result_generated": false,
        "result_ref": null,
        "source_refs": [
          "aide://report/reference-id-validation",
          "aide://report/event-record-validation"
        ],
        "title": "Reference And Event Refs Parse"
      },
      {
        "accepted_outcomes": [
          "PASS",
          "PASS_WITH_WARNINGS"
        ],
        "admission_performed": false,
        "case_id": "source-artifacts-not-mutated-by-profile",
        "case_ref": "aide://conformance-profile/minimal_capability_manifest-v1.0.0#source-artifacts-not-mutated-by-profile",
        "dependencies": [
          "capability-manifest-projection-json-valid",
          "capability-manifest-declaration-only-boundary"
        ],